idcompetence;sigle;libelle;niveauDebutant;niveauIntermediaire;niveauMaitrise;niveauExpertise
1;C2;Capacité à choisir, mettre en oeuvre ses connaissances (outils et méthodes). Utiliser ses savoirs et ses capacités d’analyse.;Niveau débutant : Même avec de l'aide, l'apprenant n'est pas encore capable de mettre en oeuvre des outils et méthodes.;Niveau intermédiaire : Avec de l'aide, l'apprenant met en oeuvre des outils et méthodes, sans s'interroger sur leur pertinence.;Niveau de maitrise : L'apprenant propose des outils et méthodes adaptés. En autonomie : il les met en oeuvre.;Niveau d'expertise : L'apprenant choisit, adapte et met en oeuvre des méthodes et outils en justifiant ses choix.
2;C3;Capacité à identifier et analyser les besoins et contraintes, formaliser le cadre de l'étude.;Niveau débutant : L'apprenant n'est pas encore capable d'identifier les besoins et les contraintes.;Niveau intermédiaire : L'apprenant identifie les besoins et les contraintes, mais avec des oublis majeurs.;Niveau de maitrise : L'apprenant analyse les besoins et les contraintes sans oubli majeur.;Niveau d'expertise : L'apprenant formalise sans oubli majeur les besoins et contraintes dans un cahier des charges.
3;C4.1;Capacité à proposer, concevoir et formaliser et faire evoluer une solution.;Niveau débutant : L'apprenant n'est pas encore capable de concevoir une solution.;Niveau intermédiaire : Avec de l'aide, l'apprenant conçoit une solution, sans formalisation.;Niveau de maitrise : Avec de l'aide, l'apprenant conçoit et formalise une solution.;Niveau d'expertise : En autonomie, l'apprenant conçoit et formalise une solution.
4;C4.2;Capacité à mettre en oeuvre et évaluer une solution.;Niveau débutant : L'apprenant n'est pas encore capable de mettre en oeuvre une solution;Niveau intermédiaire : Avec de l'aide, l'apprenant met en oeuvre et évalue une solution.;Niveau de maitrise : En autonomie, l'apprenant met en oeuvre une solution. Avec de l'aide: il l'évalue.;Niveau d'expertise : En autonomie, l'apprenant met en oeuvre une solution et l'évalue.
5;C4.3;Capacité à rédiger un document technique.;Niveau débutant : Les documents ou présentations de l\'apprenant contiennent encore de nombreuses erreurs dans le contenu et/ou dans la forme et en conséquence ils ne sont pas exploitables.;Niveau intermédiaire : L’apprenant produit des documents et présentations exploitables en interne avec encore quelques erreurs dans le contenu et/ou dans la forme.;Niveau de maitrise : En autonomie, l'apprenant produit des documents et présentation exploitables en interne.;Niveau d'expertise : En autonomie, l'apprenant produit des documents et présentations exploitables et diffusables.
6;C5;Capacité à concevoir, mener et analyser des expérimentations à des fins de recherche ou de devéloppement.;Niveau débutant : L'apprenant n'est pas encore capable de mener des mesures et des expérimentations.;Niveau intermédiaire : Avec de l'aide, l'apprenant mène et analyse des mesures et des expérimentations.;Niveau de maitrise : Avec de l'aide, l'apprenant conçoit des mesures et des expérimentations. Il les mène et les analyse en autonomie.;Niveau d'expertise : En autonomie, l'apprenant conçoit et mène des mesures et des expérimentations.
7;C6;Capacité à trouver l'information pertinente et à l'exploiter. Recherche d’information (externe ou interne de l’entreprise).;Niveau débutant : L'apprenant ne sait pas encore chercher des informations pertinantes.;Niveau intermédiaire : Avec de l'aide, l'apprenant trouve des informations pertinentes et les exploite.;Niveau de maitrise : En autonomie, l'apprenant trouve des informations pertinentes. Avec de l'aide, il les exploite.;Niveau d'expertise : En autonomie, l'apprenant trouve des informations pertinentes et les exploite.
